timestamp	status	S	fit	boundary	sweet	over	n_segs	min_words	max_words	max_duration	chars_per_sec	gap_sec	voice	description
2026-03-25T00:35:15	BASELINE	0.80932	0.9777	0.9882	0.7135	0.0719	2199	8	50		25.0		pt-BR-FranciscaNeural	Baseline for pt-BR-FranciscaNeural (proxy cps=25.0)
2026-03-25T00:35:15	DISCARD	0.65512	0.9137	0.6844	0.4834	0.0229	3672	8	50		25.0	0.1	pt-BR-FranciscaNeural	gap_sec=0.1: phase 1 sweep (proxy)
2026-03-25T00:35:15	DISCARD	0.70221	0.9365	0.7631	0.5584	0.0276	3229	8	50		25.0	0.3	pt-BR-FranciscaNeural	gap_sec=0.3: phase 1 sweep (proxy)
2026-03-25T00:35:16	DISCARD	0.77364	0.9694	0.8919	0.6686	0.0422	2580	8	50		25.0	0.5	pt-BR-FranciscaNeural	gap_sec=0.5: phase 1 sweep (proxy)
2026-03-25T00:35:16	DISCARD	0.80078	0.9763	0.9629	0.7016	0.0586	2319	8	50		25.0	0.7	pt-BR-FranciscaNeural	gap_sec=0.7: phase 1 sweep (proxy)
2026-03-25T00:35:16	DISCARD	0.80632	0.9765	0.9805	0.7088	0.066	2256	8	50		25.0	1.0	pt-BR-FranciscaNeural	gap_sec=1.0: phase 1 sweep (proxy)
2026-03-25T00:35:16	DISCARD	0.80834	0.9771	0.9857	0.7112	0.0673	2230	8	50		25.0	1.2	pt-BR-FranciscaNeural	gap_sec=1.2: phase 1 sweep (proxy)
2026-03-25T00:35:16	DISCARD	0.80916	0.977	0.9874	0.7132	0.068	2221	8	50		25.0	1.5	pt-BR-FranciscaNeural	gap_sec=1.5: phase 1 sweep (proxy)
2026-03-25T00:35:16	KEEP	0.80953	0.977	0.9874	0.7147	0.068	2219	8	50		25.0	2.0	pt-BR-FranciscaNeural	gap_sec=2.0: phase 1 sweep (proxy)
2026-03-25T00:35:16	BASELINE	0.80932	0.9777	0.9882	0.7135	0.0719	2199	8	50		25.0		pt-BR-AntonioNeural	Baseline for pt-BR-AntonioNeural (proxy cps=25.0)
2026-03-25T00:35:16	DISCARD	0.65512	0.9137	0.6844	0.4834	0.0229	3672	8	50		25.0	0.1	pt-BR-AntonioNeural	gap_sec=0.1: phase 1 sweep (proxy)
2026-03-25T00:35:17	DISCARD	0.70221	0.9365	0.7631	0.5584	0.0276	3229	8	50		25.0	0.3	pt-BR-AntonioNeural	gap_sec=0.3: phase 1 sweep (proxy)
2026-03-25T00:35:17	DISCARD	0.77364	0.9694	0.8919	0.6686	0.0422	2580	8	50		25.0	0.5	pt-BR-AntonioNeural	gap_sec=0.5: phase 1 sweep (proxy)
2026-03-25T00:35:17	DISCARD	0.80078	0.9763	0.9629	0.7016	0.0586	2319	8	50		25.0	0.7	pt-BR-AntonioNeural	gap_sec=0.7: phase 1 sweep (proxy)
2026-03-25T00:35:17	DISCARD	0.80632	0.9765	0.9805	0.7088	0.066	2256	8	50		25.0	1.0	pt-BR-AntonioNeural	gap_sec=1.0: phase 1 sweep (proxy)
2026-03-25T00:35:17	DISCARD	0.80834	0.9771	0.9857	0.7112	0.0673	2230	8	50		25.0	1.2	pt-BR-AntonioNeural	gap_sec=1.2: phase 1 sweep (proxy)
2026-03-25T00:35:17	DISCARD	0.80916	0.977	0.9874	0.7132	0.068	2221	8	50		25.0	1.5	pt-BR-AntonioNeural	gap_sec=1.5: phase 1 sweep (proxy)
2026-03-25T00:35:17	KEEP	0.80953	0.977	0.9874	0.7147	0.068	2219	8	50		25.0	2.0	pt-BR-AntonioNeural	gap_sec=2.0: phase 1 sweep (proxy)
2026-03-25T00:35:18	BASELINE	0.80932	0.9777	0.9882	0.7135	0.0719	2199	8	50		25.0		pt-BR-ThalitaNeural	Baseline for pt-BR-ThalitaNeural (proxy cps=25.0)
2026-03-25T00:35:18	DISCARD	0.65512	0.9137	0.6844	0.4834	0.0229	3672	8	50		25.0	0.1	pt-BR-ThalitaNeural	gap_sec=0.1: phase 1 sweep (proxy)
2026-03-25T00:35:18	DISCARD	0.70221	0.9365	0.7631	0.5584	0.0276	3229	8	50		25.0	0.3	pt-BR-ThalitaNeural	gap_sec=0.3: phase 1 sweep (proxy)
2026-03-25T00:35:18	DISCARD	0.77364	0.9694	0.8919	0.6686	0.0422	2580	8	50		25.0	0.5	pt-BR-ThalitaNeural	gap_sec=0.5: phase 1 sweep (proxy)
2026-03-25T00:35:18	DISCARD	0.80078	0.9763	0.9629	0.7016	0.0586	2319	8	50		25.0	0.7	pt-BR-ThalitaNeural	gap_sec=0.7: phase 1 sweep (proxy)
2026-03-25T00:35:18	DISCARD	0.80632	0.9765	0.9805	0.7088	0.066	2256	8	50		25.0	1.0	pt-BR-ThalitaNeural	gap_sec=1.0: phase 1 sweep (proxy)
2026-03-25T00:35:18	DISCARD	0.80834	0.9771	0.9857	0.7112	0.0673	2230	8	50		25.0	1.2	pt-BR-ThalitaNeural	gap_sec=1.2: phase 1 sweep (proxy)
2026-03-25T00:35:19	DISCARD	0.80916	0.977	0.9874	0.7132	0.068	2221	8	50		25.0	1.5	pt-BR-ThalitaNeural	gap_sec=1.5: phase 1 sweep (proxy)
2026-03-25T00:35:19	KEEP	0.80953	0.977	0.9874	0.7147	0.068	2219	8	50		25.0	2.0	pt-BR-ThalitaNeural	gap_sec=2.0: phase 1 sweep (proxy)
2026-03-25T00:37:06	DISCARD	0.45333	0.0865	0.9874	0.7147	0.068	2219	8	50		11.1	2.0	pt-BR-FranciscaNeural	cps_sweep: 11.1
2026-03-25T00:37:07	DISCARD	0.49029	0.1789	0.9874	0.7147	0.068	2219	8	50		13.0	2.0	pt-BR-FranciscaNeural	cps_sweep: 13.0
2026-03-25T00:37:07	DISCARD	0.54022	0.3037	0.9874	0.7147	0.068	2219	8	50		15.0	2.0	pt-BR-FranciscaNeural	cps_sweep: 15.0
2026-03-25T00:37:07	DISCARD	0.65523	0.5913	0.9874	0.7147	0.068	2219	8	50		18.0	2.0	pt-BR-FranciscaNeural	cps_sweep: 18.0
2026-03-25T00:37:07	DISCARD	0.73166	0.7823	0.9874	0.7147	0.068	2219	8	50		20.0	2.0	pt-BR-FranciscaNeural	cps_sweep: 20.0
2026-03-25T00:37:07	DISCARD	0.78213	0.9085	0.9874	0.7147	0.068	2219	8	50		22.0	2.0	pt-BR-FranciscaNeural	cps_sweep: 22.0
2026-03-25T00:37:07	DISCARD	0.80953	0.977	0.9874	0.7147	0.068	2219	8	50		25.0	2.0	pt-BR-FranciscaNeural	cps_sweep: 25.0
2026-03-25T00:37:07	KEEP	0.8162	0.9937	0.9874	0.7147	0.068	2219	8	50		28.0	2.0	pt-BR-FranciscaNeural	cps_sweep: 28.0
2026-03-25T00:37:08	KEEP	0.81674	0.995	0.9874	0.7147	0.068	2219	8	50		30.0	2.0	pt-BR-FranciscaNeural	cps_sweep: 30.0
2026-03-25T00:37:34	DISCARD	0.63753	0.6025	0.9902	0.6164	0.0511	2659	4	50		18.3	2.0	pt-BR-FranciscaNeural	min_words_sweep: 4
2026-03-25T00:37:34	DISCARD	0.64772	0.6094	0.9898	0.6483	0.0555	2542	5	50		18.3	2.0	pt-BR-FranciscaNeural	min_words_sweep: 5
2026-03-25T00:37:34	DISCARD	0.65684	0.6153	0.9889	0.6782	0.0604	2433	6	50		18.3	2.0	pt-BR-FranciscaNeural	min_words_sweep: 6
2026-03-25T00:37:34	DISCARD	0.66459	0.6189	0.9884	0.7055	0.0647	2333	7	50		18.3	2.0	pt-BR-FranciscaNeural	min_words_sweep: 7
2026-03-25T00:37:34	DISCARD	0.66857	0.6246	0.9874	0.7147	0.068	2219	8	50		18.3	2.0	pt-BR-FranciscaNeural	min_words_sweep: 8
2026-03-25T00:37:34	DISCARD	0.66866	0.6297	0.9867	0.7108	0.0759	2109	9	50		18.3	2.0	pt-BR-FranciscaNeural	min_words_sweep: 9
2026-03-25T00:37:35	DISCARD	0.67021	0.64	0.9856	0.7046	0.0834	2014	10	50		18.3	2.0	pt-BR-FranciscaNeural	min_words_sweep: 10
2026-03-25T00:37:35	DISCARD	0.66573	0.6465	0.9845	0.6822	0.0952	1932	11	50		18.3	2.0	pt-BR-FranciscaNeural	min_words_sweep: 11
2026-03-25T00:37:35	DISCARD	0.65846	0.6522	0.9832	0.649	0.1049	1849	12	50		18.3	2.0	pt-BR-FranciscaNeural	min_words_sweep: 12
2026-03-25T00:37:56	DISCARD	0.77492	0.8905	0.9874	0.7147	0.068	2219	8	50		21.6	2.0	pt-BR-ThalitaNeural	min_words_sweep_thalita: 8
2026-03-25T00:37:56	DISCARD	0.77544	0.8966	0.9867	0.7108	0.0759	2109	9	50		21.6	2.0	pt-BR-ThalitaNeural	min_words_sweep_thalita: 9
2026-03-25T00:37:56	DISCARD	0.77666	0.9062	0.9856	0.7046	0.0834	2014	10	50		21.6	2.0	pt-BR-ThalitaNeural	min_words_sweep_thalita: 10
2026-03-25T00:37:56	DISCARD	0.77174	0.9115	0.9845	0.6822	0.0952	1932	11	50		21.6	2.0	pt-BR-ThalitaNeural	min_words_sweep_thalita: 11
2026-03-25T00:37:56	DISCARD	0.76468	0.9178	0.9832	0.649	0.1049	1849	12	50		21.6	2.0	pt-BR-ThalitaNeural	min_words_sweep_thalita: 12
2026-03-25T11:04:30	DISCARD	0.66888	0.6432	0.9763	0.7028	0.0818	2029	10	40		18.3	2.0	pt-BR-FranciscaNeural	max_words_sweep: 40
2026-03-25T11:04:30	DISCARD	0.67021	0.64	0.9856	0.7046	0.0834	2014	10	50		18.3	2.0	pt-BR-FranciscaNeural	max_words_sweep: 50
2026-03-25T11:04:30	DISCARD	0.67262	0.6405	0.9935	0.7054	0.0834	2003	10	60		18.3	2.0	pt-BR-FranciscaNeural	max_words_sweep: 60
2026-03-25T11:04:30	DISCARD	0.67316	0.6398	0.9965	0.7059	0.0835	1999	10	70		18.3	2.0	pt-BR-FranciscaNeural	max_words_sweep: 70
2026-03-25T11:04:30	DISCARD	0.6734	0.6396	0.9975	0.7057	0.0826	1998	10	80		18.3	2.0	pt-BR-FranciscaNeural	max_words_sweep: 80
2026-03-25T11:04:30	DISCARD	0.67345	0.6391	0.998	0.7062	0.0826	1998	10	100		18.3	2.0	pt-BR-FranciscaNeural	max_words_sweep: 100
2026-03-25T11:04:30	DISCARD	0.67366	0.6395	0.9985	0.7061	0.0826	1997	10	120		18.3	2.0	pt-BR-FranciscaNeural	max_words_sweep: 120
2026-03-25T11:05:59	DISCARD	0.77666	0.9062	0.9856	0.7046	0.0834	2014	10	50		21.6	2.0	pt-BR-ThalitaNeural	max_words_sweep_thalita: 50
2026-03-25T11:05:59	DISCARD	0.77941	0.9055	0.9965	0.7059	0.0835	1999	10	70		21.6	2.0	pt-BR-ThalitaNeural	max_words_sweep_thalita: 70
2026-03-25T11:05:59	DISCARD	0.77995	0.9054	0.998	0.7062	0.0826	1998	10	100		21.6	2.0	pt-BR-ThalitaNeural	max_words_sweep_thalita: 100
2026-03-25T11:05:59	DISCARD	0.78002	0.9054	0.9985	0.7061	0.0826	1997	10	150		21.6	2.0	pt-BR-ThalitaNeural	max_words_sweep_thalita: 150
2026-03-25T11:07:54	DISCARD	0.67345	0.6391	0.998	0.7062	0.0826	1998	10	100		18.3	2.0	pt-BR-FranciscaNeural	max_dur_sweep: None
2026-03-25T11:07:55	DISCARD	0.62416	0.6713	0.4955	0.9306	0.0084	3197	10	100	3.0	18.3	2.0	pt-BR-FranciscaNeural	max_dur_sweep: 3.0
2026-03-25T11:07:55	DISCARD	0.64218	0.6699	0.5883	0.9126	0.0102	2757	10	100	4.0	18.3	2.0	pt-BR-FranciscaNeural	max_dur_sweep: 4.0
2026-03-25T11:07:55	DISCARD	0.65458	0.6627	0.6707	0.8925	0.0128	2502	10	100	5.0	18.3	2.0	pt-BR-FranciscaNeural	max_dur_sweep: 5.0
2026-03-25T11:07:55	DISCARD	0.66907	0.6621	0.7624	0.8618	0.0181	2323	10	100	6.0	18.3	2.0	pt-BR-FranciscaNeural	max_dur_sweep: 6.0
2026-03-25T11:07:55	DISCARD	0.66837	0.6619	0.8237	0.799	0.0207	2224	10	100	7.0	18.3	2.0	pt-BR-FranciscaNeural	max_dur_sweep: 7.0
2026-03-25T11:07:55	DISCARD	0.66084	0.6502	0.9273	0.6914	0.0392	2090	10	100	10.0	18.3	2.0	pt-BR-FranciscaNeural	max_dur_sweep: 10.0
2026-03-25T13:36:52	DISCARD	0.45123	0.0836	0.998	0.7062	0.0826	1998	10	100		11.1	2.0	pt-BR-FranciscaNeural	gap_sec=2.0 max_words=40: hypothesis tighter max_words lifts fit at 11.1 cps
2026-03-25T13:37:22	DISCARD	0.44492	0.0833	0.9763	0.7028	0.0818	2029	10	40		11.1	2.0	pt-BR-FranciscaNeural	gap_sec=2.0 max_words=40: hypothesis tighter max_words lifts fit at 11.1 cps
2026-03-25T13:37:41	DISCARD	0.44032	0.0826	0.9614	0.6978	0.0753	2045	10	35		11.1	2.0	pt-BR-FranciscaNeural	gap_sec=2.0 max_words=35: hypothesis tighter max_words lifts fit at 11.1 cps
2026-03-25T13:37:56	DISCARD	0.43741	0.0812	0.941	0.7042	0.0638	2069	10	30		11.1	2.0	pt-BR-FranciscaNeural	gap_sec=2.0 max_words=30: hypothesis tighter max_words lifts fit at 11.1 cps
2026-03-25T13:38:12	DISCARD	0.43011	0.0831	0.8847	0.7227	0.0501	2117	10	25		11.1	2.0	pt-BR-FranciscaNeural	gap_sec=2.0 max_words=25: hypothesis tighter max_words lifts fit at 11.1 cps
